{"attempts":[{"attemptId":"1b2c3d4e-5f6a-4b8c-9d0e-1f2a3b4c5d41","attemptOrdinal":1,"receipt":{"byteLength":3109,"digest":"sha256:665b0cf40e1b876cb856e6eb17a403f2b7740f59ea981e8651211bf924e6196c","mediaType":"application/vnd.rawframe.evidence.raw-run-receipt.v1+json"},"repetitionOrdinal":1,"status":"completed"}],"compatibility":{"cellFingerprint":"cell-v1-0001","closureFingerprint":"closure-v1-0001","configuration":"shipping","harnessId":"rawframe.tool.run_harness","metricRegistryGeneration":1,"platformId":"platform.linux","profileId":"headless_networked_luau_world_v1","runnerGeneration":1,"targetId":"rawframe.host.dedicated_server","workloadFingerprint":"workload-v1-0001"},"eligibleAttemptIds":["1b2c3d4e-5f6a-4b8c-9d0e-1f2a3b4c5dff"],"evidenceSetId":"aaaaaaaa-bbbb-4ccc-8ddd-eeeeeeeeeeee","planId":"c1a20001-0000-4000-8000-000000000001","recordKind":"evidence_set","schedule":{"attemptCount":1,"repetitionCount":1},"schemaVersion":1,"tier":"tier_0","trust":{"provenance":"diagnostic_untrusted"}}